{
  "schema_version": "evidence-graph-temporal-seed-v1",
  "initial_reviewed_at": "2026-08-20T09:00:00Z",
  "correction_reviewed_at": "2026-08-21T09:00:00Z",
  "as_of": "2026-08-20T12:00:00Z",
  "initial": {
    "assertion_id": "ast_policy_requirement_initial",
    "relationship_id": "rel_policy_requirement_initial",
    "evidence_target_id": "etg_policy_directive",
    "anchor_text": "Directive 3000.09",
    "object_value": "Directive 3000.09"
  },
  "corrected": {
    "assertion_id": "ast_policy_requirement_corrected",
    "relationship_id": "rel_policy_requirement_corrected",
    "evidence_target_id": "etg_policy_lawful_purposes",
    "anchor_text": "all lawful purposes",
    "object_value": "all lawful purposes"
  }
}
